"Chiranjeevi in Naga Chaitanya - Samantha Reception , Chaitanya,Samantha Akkineni,Nag,Venkatesh,Megastar Chiranjeevi,Megastar Chiranjeevi @ #ChaySam Wedding Reception,Chiranjeevi @ #ChaySam Wedding Reception,Naga Chaitanya - Samantha Akkineni Reception LIVE,Naga Chaitanya,Samantha,Naga Chaitanya Samantha,Nagarjuna,#ChaiSam,Reception LIVE,Akkineni Reception,chiranjeevi rama charan,Akkineni family,Daggubati family,reception"
"TYPES OF STUDENTS ELVISH YADAV,elvish yadav,elvish yadav new video,elvish yadav latest video,elvish yadav vines,elvish yadav videos,students video,types of students in a class,omprakash new song,sot lagani hai,elvis yadav vines"
"Aatish new punjabi song 2017,latest punjabi songs 2017 Aatish,new punjabi songs 2017 Jannat,latest punjabi song 2017 Jannat,new songs 2017 Aatish,latest song 2017 Aatish,Aatish,punjabi songs 2017 Aatish,punjabi music videos Aatish,Jannat punjabi song 2017,new punjabi songs,latest punjabi songs,new songs,latest songs,songs 2017,punjabi,Aatish songs,Jannat by Aatish,punjabi song,whte hill,aatish taare,romantic songs punjabi"
"Jump cuts,Jumpcuts,Tamil comedy,Tamil Comedy Videos,new bike vs old bike,jumpcuts reality,the reality,bike scenario jumpcuts,jumpcuts bike story,hari baskar videos,hari baskar jumpcuts,hari baskar bike video,tamil viral videos,viral videos,trending videos,jumpcuts trending videos,swathi videos,kaghs,jumpcuts old vs new,jumpcuts tamil comedy,jumpcuts youtube channel,hot story jumpcuts,hot scenario"
"IT Raid,Tamil Live News,Dhivakaran,Jaya Tv,Raid At Jaya TV,vivek jayaraman,Sasikala Family Raid,Puthiya Thalaimurai,jazz cinemas sasikala,puthiya thalaimurai news today morning,tamil latest news,Tamil News Today,sun news today 7.30pm,Nerpada Pesu,TTV Raid,Vivek,IT Dept Raids,Krishnapriya"
"Nagarjuna Funny Comments on Samantha Dress,Naga Chaitany Samantha Akkineni Wedding Reception 2017,nagarjuna shocking comments on samantha dress,nagarjuna funny comments,samantha dress,samantha wedding reception,samantha,dress,nagarjuna,funny,naga chaitany,naga chaitany samantha,samantha wedding,#chaisam,akkineni reception live,grand reception for #chaysam,samantha akkineni,naga chaitanya,akkineni naga chaitanya,samantha marriage video"
"seeman,seeman interview,madras central,paridhabangal,gopi,sudhakar,gopi sudhakar,madras central videos,seeman speech,seeman controversy,naughty nights,black sheep,seeman spoof,smile settai,beep show,gopi seeman,gosu,GOSU,gopi black sheep,seeman black sheep,seeman madras central,madras central gopi,madras central sudhakar,half boil,seeman naughty nights,naughty nights gopi,gopi naughty nights,naughty nights new,black sheep new"
"Vivek Bindra,Case Study by Vivek Bindra,Leadership Trainers in India,Best Motivational Speaker in India,Business Training,Indian Rich List,Entrepreneurship,SME,Corporate Training,Best Corporate Trainers in India,Leadership Skills,Leadership Funnel,Acharya Balkrishna,Baba Ramdev,Patanjali,Dabur,HUL,P&G"
"Nenu Local,Nenu Local Telugu Movie,Nani,Sai Pallavi,Dil Raju,Devi Sri Prasad,Telugu Latest Movies,Telugu Full Movies,Telugu Comedy Movies,Nani Trailer,Nani Movies,MCA MOVIE,Middle Class Abbayi,MCA,MCA - Middle class abbayi,Fidaa,Nani MCA,MCA Trailer,MCA Teaser,MCA First Look,Nani MCA Teaser,Nani MCA Trailer"
"nextgen,sasikala,sasikala natarajan,aiadmk,tamil nadu,jayalalithaa,jayalalitha,tamil news,apollo hospital,sasikala pushpa,it raid,sasikala family,income tax raid,latest tamil news,latest news,politics,tamil news today,ops,tamilnadu,admk,youtube,news in tamil,tamil nadu cm,tamil,vivek,vivek jayaram,jayalalitha uyil,apollo cd it raid"
"flowers tv,uppum mulakum,uppum,biju sopanam,Balanchandran,Neelima,juhi rustagi,flower tv comedy,flower tv malayalam,balanchandran,entertainment,best comedy serial malayalam,s p sreekumar,college campus comedy,marimayam,sneha sreekumar,programme,moosa,m80 moosa,funny,flower tv comedy night,malayalam comedy,+uppum mulakum"
"Vaani rani,rani,Radhika in funny character,venu aravind,SunTV,VaniRani,vani,vaani,Radhikas dual role serial,Ranimma veetu kuripu,Radhika as lawyer in serial,radikaa,rathika,Radhikas new"
"tv9,HD TV9,tv9 live,TV9 Telugu HD,TV9 News HD,HD Breaking News,Live TV9 HD,tv9 news,tv9 telugu,tv9 ap,tv9 breaking news,tv9 youtube,tv9 online,Tv9 HD,https://youtu.be/zFrllD9D9HM,mahesh kathi,pawan kalyan,hyper adhi,hyper adhi punches"
"Sir post,EPS TRoll,Smile settai letter to EPS,smile settai sir post to eps,Cartoonist Bala,Cartoonist bala arrest,Smile settai troll video,Settai night latest,Sir post latest,#SirPost,Cartoonist arrest in TN,Cartoonist bala cartoon,Bala cartoon,TN CM EPS,Smile settai latest video"
"Prank Call,Funny Reactions,Pranks In India 2017,comedy video,meri setting karade live,Bhai meri bhi setting karwa funny video,tst rahul,tst rahul prince,Pranks in India,Prank on Girls,girls in love,love,friendship,dost,relationship,tst latest video,pranks,pramk on girls,funny,TroubleSeekerTeam,prank on girls,best prank on girls,best girl pranks,girl pranks,tst girls prank,indian prank,language in india,indian pranks,best indian prank,comedy"
"tamil news,tamilnadu politics comedy,tamil political speech,tamil political fight,latest tamil news,tamil news today,tamil news online,newsglitz,nakkeeran gopal interview,nakkeeran gopal latest interview,nakkeeran gopal speech,nakkeeran gopal speech about jayalalitha,nakkeeran on raid,nakkheeran about sasikala,sasikala raid,sasikala latest"
"zameer,zameer harsimran,zameer aarsh benipal,harsimran songs,aarsh benipal,harsimran new song,aarsh benipal new song 2017,song teaser,aarsh benipal harsimran,latest punjabi songs,harsimran,new punjabi song teaser,song teaser 2017,punjabi song teaser,zameer punjabi song,arsh benipal songs,zameer songs"
"asli fighter,asli fighter (okka ammayi thappa) 2017 hindi dubbed,okka ammayi thappa full movie hindi dubbed,sundeep kishan movies in hindi dubbed,ravi kishan south movie in hindi,nithya menon movies hindi dubbed,nithya menen,ravi kishan,rahul dev,south indian movies dubbed in hindi full movie 2017 new,latest hindi dubbed movies 2017,new release south indian movies dubbed in hindi 2017,latest 2017 south indian movies dubbed in hindi"
"the voice of india,TVOI,the voice of india kids,audition,singers,singing talent,kids voice,kids singing,kids talent,Talpa media,AndTV,&TV"
[none]
"fire in annapurna studios,annapurna studios,hyderabad ANRs annapurna studios,annapurna studios 7 acres,manam set got fire in annapurna studios,fire accident in annapurna 7 acres,nagarjuna response to media on f ire mishap,akkineni nagarjuna response on fire accident,set fire accident on annapurna,manam building got fire in annapurna studios,breaking news,i news telugu channel,i news telugu online,i news youtube,i news channel,I news,i news online"
"Ayurved samadhan,beauty,madhumeh,nuskha,nuskhe,gharelu upay,fat,belly fat,long hair,slim body,food,healthy food,daily routine,à¤¸à¥à¤¬à¤¹-à¤¸à¥à¤¬à¤¹ à¤…à¤œà¤µà¤¾à¤‡à¤¨ à¤•à¤¾ à¤ªà¤¾à¤¨à¥€ 4 à¤¦à¤¿à¤¨ à¤ªà¥€à¤¨à¥‡ à¤•à¥‡ à¤¬à¤¾à¤¦ à¤†à¤ª à¤–à¥à¤¦ à¤šà¥Œà¤•à¤¨à¥à¤¨à¥‡ à¤¹à¥‹ à¤œà¤¾à¤¯à¥‡à¤‚à¤—à¥‡// Ayurved Samadhan"
"last week tonight trump presidency,last week tonight donald trump,john oliver trump,donald trump"
"Mazhavil,Manorama,D4 Junior Vs Senior,EP 84,Appani Sarath with Jimikki Kammal"
"wwe,world wrestling entertainment,wrestling,wrestler,wrestle,superstars,à¤•à¥à¤¶à¥à¤¤à¥€,à¤ªà¤¹à¤²à¤µà¤¾à¤¨,à¤¡à¤¬à¥à¤²à¥‚ à¤¡à¤¬à¥à¤²à¥‚ à¤ˆ,à¤®à¥ˆà¤š,à¤¸à¥à¤ªà¤°à¤¸à¥à¤Ÿà¤¾à¤°,à¤µà¥à¤¯à¤¾à¤µà¤¸à¤¾à¤¯à¤¿à¤• à¤•à¥à¤¶à¥à¤¤à¥€,Ù…ØµØ§Ø±Ø¹Ù‡,Raw,Stephanie McMahon,Kurt Angle,Roman Reigns,Dean Ambrose,Seth Rollins,raw clips,the shield,shield returns,raw highlights,monday night raw"
"the hungama films,10 years old,pyar ho jayega on girls,10 year old picking up girls,11 year old kid picking up hot girls,kid picking up girls,picking up girls,10 years old kid prank,kid picking up girl,child picking up girls,picking up chicks,kid prank,prank in india,pranks in india 2017,indian prank,prank on girls,best pranks 2017,pranks in 2017,best pranks of 2017,prank on cute girls,prank on hot girls,prank on indian girls,hot girls prank"
"moto x4 unboxing,moto x4,moto x4 india,moto x4 hands on,noto x4 camera,moto x4 review,geekyranjit"
"tarang,tarang tv,tarang tv online,tarang tv serial,odia tarang tv serial,tarang tv show,taranga channel,tarang tv channel,odia tarang channel,odia serial,odia serial video,odia channel,odia tv channel,odia tv show,odia tv,ama ghara laxmi,ama ghara laxmi serial,ama ghara laxmi today episode,ama ghara laxmi odia serial,tarang tv serial ama ghara laxmi,ama ghara laxmi serial song"
[none]
"Tiger Zinda Hai Trailer,Tiger Zinda Hai Spoof,Tiger Zinda Hai Songs,Salman Khan Tiger Zinda Hai,Salman Khan,Katrina Kaif,salman khan songs,Tiger Zinda Hai Movie,SDE,Shudh Desi Endings"
"saas bahu beti,saas bahu aur beti,saas bahu aur betiyaan,entertainment show,TV celebs,tv shows,hindi shows,entertainment videos,celeb interviews,tv actors,tv actress,popular tv actors"
"the,screen,patti,bonnet,pe,charcha,daaru,harsh,beniwal,funny,comedy,humor,drama,sketch,zindagi,na,milegi,dobara,dil,chahta,hai,ye,jawaani,diwaani,kabira,rabish,ki,report,kyun,bane,crorepati,bade,chote"
"Short hair,hair,hairstyle,styling,long hair,tired of hearing,fashion,style,girls,women,sketch comedy,meme,funny,haha,filtercopy,filter copy,pocket aces,dice media,viral video,webseries,web series,comedy,all india bakchod,being indian,tvf qtiyapa,scoopwhoop,rajnikant vs CID jokes,RVCJ,buzzfeed,east india comedy,the virl fever,timeliners,girliyapa,netflix,BYN,ashish chanchalani,vines,screenpatti,bakchod,SIT"
"sng,comedy,vidya balan,sulu,tumhari sulu,movie,release,miracles,believe,varun thakur,bollywoodgandu,craziebawa,aadar"
"ADMK,Jayalalithaa,Sasikala,Ilavarasai,Vivek,Dinakaran,TTV"
"etvtelugu,AlithoJollygaa,comedian,scenes,videos,clips,skit,spoof,pooter,comedy,fails,HD,funny,compilation,free,full,movie,hot,latest,heroine,brahmanandam,songs,mahesh,news,live,audio,yoga,ayurveda,attack,accident,trailer,teaser,ragini mms,baahubali,galaxy,legend,ali 369 latest episode,ali 369 game show,bhale chance le,dammu game show,ali 369 hot,ali 369 all episodes,etv ali 369,ole ola,Ali tho Jallygaa,Alitho Saradaga"
"Bithiri Sathi,Bithiri Sathi Village,Bithiri Sathi Leaves Hyderabad,Bithiri Sathi On Ivanka Trump,Bithiri Sathi Changes Getup,Bithiri Sathi New Getup,Bithiri Sathi On Beggars,ghmc mayor,ghmc drive on beggars,beggars income,beggars in hyderabad,beggers in hyderabad,hyderabad begger free city,begger free city,beggar free city,beggars in city,Ivanka Trump India Tour,Ivanka Trump Hyderabad Visit,global entrepreneurship,V6 News,teenmaar News,V6 Teenmaar News"
"Tiger Zinda Hai Trailer,Tiger Zinda Hai Official Trailer,Tiger Zinda Hai Teaser,Tiger Trailer,Trailer of Tiger Zinda Hai,Salman Khan Song,Salman Khan Movie Trailer,Bollywood Trailer,Hindi Trailer,Salman Khan Tiger Zinda Hai Trailer,Trailer 2017,Most Viewed Trailer,Official Trailer 2017,Salman Katrina Movie,Salman Khan Trailer 2017,2017 Bollywood Trailer,Official Trailer Tiger Zinda Hai,Latest Movie Trailer,Salman Khan,Katrina Kaif,Vishal and Shekhar,YRF"
"Eagle Media Works,Eagle Media Works Logo,Eagle Media,Media,Subscribe,Amala and lakshmi Face to face,amala and nagarjuna first wife face to face,amala,akkineni amala,naga chaitanya mother in reception,samantha,akkineni samantha,samantha angry on chaitu mother,nagarjuna,akkineni nagarjuna,akhil,naga chaitanya and samantha reception,trending videos,gossips,viral videos,à°°à°¿à°¸à±†à°ªà±à°·à°¨à± à°²à±‹ à°¸à°®à°‚à°¤ à°ˆà°®à±†à°ªà±ˆ à°•à±‹à°ªà±à°ªà°¡à°Ÿà°‚ à°®à±€à°°à± à°—à°®à°¨à°¿à°‚à°šà°¾à°°à°¾,Samantha Gets Angry in Reception"
"Sun TV Tamil serials,Vamsam (TV Program),Vamsam Tamil Serial,Vijayakumar (Film Actor),à®µà®®à¯à®šà®®à¯,Vasam serial,Sun TV Serial,Sun TV Vamsam,vamsam latest episode,Vamasam,Vamsam Todays episode,Vision Time tamil,Vamsam1333 Tamil family drama,Tamil Serials,Visiontime,Tamizh soaps,Vamsam 1333,vamsam episode 1333,vamsam 13 11 2017,1333 Vamsam,Vamsam,Episode,1333"
"rowi na,nadha virender,prabh grewal,latest punjabi songs 2017,new punjabi songs 2017,best punjabi songs 2017,brand new punjabi songs,punjabi songs,punjabi,songs,new,latest,rowi,na,nadha,birender,parmish verma,parmish,punjabi sad songs,punjabi love songs,punjabi romantic songs,new punjabi sad song,sad song,best sad songs,best song of the week"
"CID,Shivaji Satam,Aditya Srivastava,Dayanand Shetty,Hrishikesh Pandey,ACP Pradyuman,Inspector Abhijeet,Doctor Salunkhe,Sony PAL,Sony LIV,Indian TV Serial,Indian Soaps,SET India,Crime Patrol,adaalat,sony pal show,sony,cid episode,SET,CID 2017,CID new episode,Purvi CID,Abhijeet CID,watch cid online,watch cid for free,investigation,cid ep1217,CID 1217,dead pilot"
"november 2017 current affairs,november,november 2017,current,affairs,current affairs,study iq,studyiq,study,iq,best,gk,general knowledge,general,knowledge,static,static gk,upsc,ssc,cgl,chsl,lic,ldc,mts,ibps,po,clerk,sbi,up,pcs,psc,mp,andhra,telangana,2017,2018,2019,2020,clat,bba,exam,exams,top,read,for,to,on,at,from,hindi,in hindi,english,current affairs 2017,issue,debate,discussion,uppsc,uppcs,mppsc,cgpsc,tpsc,tspsc,appsc,mpsc,ras,rpsc,reet,jssc,ssc cgl,ssc ldc,steno,the"
"Moviebuff,Moviebuff Sneak Peek,MBSneakPeek,Tamil Movie,Tamil Movie Trailer,Tamil Movie Teaser,New Tamil Movie 2017,En Aaloda Seruppa Kaanom,EASK,en aaloda seruppa kaanom teaser,en aaloda seruppa kaanom trailer,en aaloda seruppa kaanom promo,en aaloda seruppa kaanom songs"
"Saravanan Meenatchi,Saravanan Meenakshi,SM,Family Drama,Soap,Teacher,love,romance,marriage,vows,Vijay TV,Star VIjay,Vijay,Star Vijay TV,Fiction,Serial,Thamizh,Soundharya,Rajasekar,Sharadha,Kuyili,Sudha,Ramya,Maggi,à®•à®¾à®¤à®²à¯,à®•à®²à¯à®¯à®¾à®£à®®à¯,à®šà®°à®µà®£à®©à¯,à®®à¯€à®©à®¾à®Ÿà¯à®šà®¿,à®šà®£à¯à®Ÿà¯ˆ,à®¤à®®à®¿à®´à¯,à®¨à¯†à®Ÿà¯à®¨à¯à®¤à¯Šà®Ÿà®°à¯,à®µà®¿à®œà®¯à¯,à®Ÿà®¿à®µà®¿,à®¤à¯Šà®²à¯ˆà®•à¯à®•à®¾à®Ÿà¯à®šà®¿,Tamil TV,Tamil Shows,Redefining Entertainment,promo,rakshitha,kavin,RIO,VJ"
"Genes,Genes Show,Genes Videos,Genes Telugu Show,Genes Entertainment Show,Genes Latest Video,Genes New Video,Genes Latest Videos,Genes Telugu Videos,Suma Entertainement Show,Suma Comedy With Stars,Genes Tollywood Game Show,Genes Latest Promo,Telugu Latest Shows,Latest Promos,Telugu Promos,Suma Fun at Genes,Suma Punches,Suma Counter,Suma Funny Punches,Yadammaraju"
"sdi,islam,preacher,sunni,sunni ijtema,ijtema 2017,Final Day,27 Annaul Ijtema"
"so effin cray,so effin cray latest,iphone x,iphone prank,iphone x in india,pranks in india,best pranks in india,iphone 8,iphone 8 plus,funny video,funny videos whatsapp,whatsapp funny,pranks in india 2017,so effin cray pranks,cheater girlfriend prank,how to get a hot girlfriend,so effin cray videos,kiss and run prank,prank on girls"
"namma karunaadu,namma karunadu,à²¸à²°à²¿à²—à²®à²ª,Rajesh Krishnan,Rajesh Krishnan left Zee Kannada,Zee Kannada Sa ri ga ma pa,Sa ri ga ma pa show,Rajesh Krishnan left Sa ri ga ma pa show,Rajesh Krishnan Sa ri ga ma pa show,Rajesh Krishnan leaving Sa ri ga ma pa,Rajesh Krishnan song in Sa ri ga ma pa"
SHANtell martin
"dreams n beyond,dreamsnbeyond,ranjith shankar,Punyalan Private Limited,Punyalan Private Limited Official Teaser 2,punyalan private limited trailer,jayasurya,aju varghese,punyalan 2 trailer,punyalan kalippu teaser,punyalan 2 teaser,punyalan 2 teaser trailer,punyalan private limited,punyalan 2 official trailer,punyalan private limited movie,punyalan private limited theatrical trailer,punyalan private limited official trailer,punyalan 2,punyalan agarbatis,dq,new"
"à°«à°‚à°•à±à°·à°¨à± à°šà°¿à°µà°°à°²à±‹ à°°à°¾à°¨à°¾ à°¸à°®à°‚à°¤ à°¨à°¿ à°Žà°²à°¾ à°†à°¡à±à°•à±à°¨à±à°¨à°¾à°¡à±‹ à°šà±‚à°¡à°‚à°¡à°¿,Rana Fun With Samantha At Her Wedding Reception,samantha,Naga Chaitanya - Samantha Akkineni Reception LIVE,Naga Chaitanya,Naga Chaitanya Samantha,Nagarjuna,#ChaiSam,Rana Daggubati,Malavika Daggubati,Sam Chay Reception,Daggubati Family at Sam Chay Reception,Samantha Wedding reception,Samantha Naga Chaitanya Reception,Daggubati Family at samantha naga chaitanya Reception,celebrrities at sam and chai wedding"
"etv Plus,etv comedy show,3 Idiots,anchor ravi,Chinnadana Neekosam,express raja,hungama,Kick,Nandini Vs Nandini,Pataas,jabardasth,extra jabardasth,naga babu,roja,anchor anasuya,pove pora,comedy short films,yadamma raju,chalaki chanti,sudigali sudeer,anchor suma,comedy show,anchor sreemukhi,comedy skits in telugu,telugu comedy tracks,racha ravi,allare allari,sardaga kasepu,ejunction,anchor pradeep,pataas punches,anchor vishnupriya,getup srinu"
"the daily show,trevor noah,daily show with trevor noah,new trevor noah show,comedy central politics,the daily show episodes,How the Right Politicized Roy Moores Sexual Misconduct,sexual assault,Republicans,late night talk show hosts,comedy central,stand up comedy,comedians,comedy central comedians,comedy,funny,comedian,funny video,comedy videos,stand up videos,funny jokes,funny clips,hilarious videos,hilarious clips"
"Rana hungama at #ChaySam Wedding Reception , TV9"
"sjlovesjewelry,shreya jain,indian beauty guru,indian makeup guru,indian vlogger,Indian Bridal Makeup Tutorial , Lots Of Tips & Tricks! , Shreya Jain"
"extreme,danger,fall,cliff,comedy,stupid,thalliwell"
"gossips,gossip adda,tollywood,tollywood news,tollywood updates,à°¸à°®à°‚à°¤ à°† à°¡à±à°°à°¸à± à°¤à±‹ à°¤à°¨ à°ªà°°à±à°µà± à°Žà°²à°¾ à°¤à±€à°¸à±à°•à±à°‚à°¦à±‹ à°šà±‚à°¡à°‚à°¡à°¿,à°¸à°®à°‚à°¤,à°† à°¡à±à°°à°¸à± à°¤à±‹,à°¤à°¨ à°ªà°°à±à°µà±,à°Žà°²à°¾,à°¤à±€à°¸à±à°•à±à°‚à°¦à±‹,à°šà±‚à°¡à°‚à°¡à°¿,Samantha Naga Chaithanya Wedding Reception,Samantha Naga Chaithanya Wedding,Chaitanya,Samantha Akkineni,Naga Chaitanya - Samantha Akkineni Reception LIVE,Naga Chaitanya,Samantha,Naga Chaitanya Samantha,Nagarjuna,Akkineni Reception,chiranjeevi rama charan,Akkineni family,Daggubati family"
"YASHWANT SINHA,GST,NOTEBANDI,RENT,TAX,NITISH KUMAR SPEECH,BIHAR VIDHANSABHA,MAHAGATBANDHAN,SHARAD YADAV,TEJASWI YADAV,RJD LEADER TEJASHWI YADAV BEST SPEECH,BIHAR YATRA,LALUS RALLY,LALU YADAV MAHARALLY,PATNA,LALU YADAV BIG RALLY,LALU RALLY,MODI GOVERNMENT,COW,MEAT,BEEF,RSS,MOB LYNCHING,DELHI,MUSLIM,JANTAR MANTAR,PM MODI,DELHI GOVERNMENT,LOKSABHA,RAJYASABJHA"
"hindi tv serial,set india,sony set serials,childrens day special,celebrate childrens day,childrens day videos,videos for kids,the kapil sharma show,khajoor from kapil sharma,fun with khajur,abhishek bachchan,aishwarya rai bachchan,khajur bachchan,kapil sharma funny videos,khajur funny videos,khajur special,khajur vs mayur,khajur running coach,manoj bajpayee,special clips,Childrens Day with Khajur,khajur with varun,khajur fools john"
"Naga Chaitanya,Naga Chaitanya mother,mother,lakshmi,naga chaitanya mother lakshmi,Lakshmi Daggubati,Samantha,Samantha emotional,Samantha smile,smile,Samantha Naga Chaitanya,Samantha Naga Chaitanya Wedding,Wedding,Wedding Reception,Reception,hyderabad,akkineni,akkineni family,nagarjuna wife,amala,akkineni amala,samantha naga chaitanya marriage,marriage,samantha marriage,samantha akkineni,samantha family,family,tollywood,movies,telugu movies,celebs"
"Hindi Khabar,UttarPradesh,Uttrakhand,BundelKhand,AtulAgrawal,DigitalMedia,UP,Yogi Adityanath,Yogi Sarkar,à¤…à¤–à¤¿à¤²à¥‡à¤¶ à¤¯à¤¾à¤¦à¤µ,à¤®à¤¾à¤¯à¤¾à¤µà¤¤à¥€,à¤¯à¥‹à¤—à¥€ à¤†à¤¦à¤¿à¤¤à¥à¤¯à¤¨à¤¾à¤¥,à¤¬à¥€à¤œà¥‡à¤ªà¥€,à¤¸à¤ªà¤¾,à¤¬à¤¸à¤ªà¤¾,à¤•à¤¾à¤‚à¤—à¥à¤°à¥‡à¤¸,à¤•à¥‡à¤¶à¤µ à¤ªà¥à¤°à¤¸à¤¾à¤¦ à¤®à¥Œà¤°à¥à¤¯,à¤¡à¥‰. à¤¦à¤¿à¤¨à¥‡à¤¶ à¤¶à¤°à¥à¤®à¤¾,à¤²à¤–à¤¨à¤Š,à¤—à¥‹à¤°à¤–à¤ªà¥à¤°,à¤µà¤¾à¤°à¤¾à¤£à¤¸à¥€,à¤¹à¤¿à¤¨à¥à¤¦à¥€ à¤–à¤¼à¤¬à¤°,à¤¨à¤°à¥‡à¤¨à¥à¤¦à¥à¤° à¤®à¥‹à¤¦à¥€,SP,BJP,Congress,Dinesh Sharma,Keshaw Prasad Maurya"
"Tiger Zinda Hai Trailer,Tiger Zinda Hai Official Trailer,Tiger Zinda Hai Teaser,Tiger Trailer,Trailer of Tiger Zinda Hai,Bollywood Trailer,Trailer 2017,Latest Movie Trailer,tona totka,tone,lal kitaab,pandit ji talk,chamatkari samsya,chamatkari upay,à¤˜à¤° à¤®à¥‡à¤‚ à¤šà¥à¤ªà¤šà¤¾à¤ª à¤¯à¤¹à¤¾à¤ à¤°à¤– à¤¦à¥‡ à¤à¤• à¤²à¥Œà¤‚à¤—,à¤‡à¤¤à¤¨à¤¾ à¤¬à¤°à¤¸à¥‡à¤—à¤¾ à¤ªà¥ˆà¤¸à¤¾ à¤•à¤¿ à¤†à¤ª à¤¸à¤‚à¤­à¤¾à¤² à¤¨à¤¹à¥€à¤‚ à¤ªà¤¾à¤“à¤—à¥‡,ayurvedic,ayurevda,home treatment,home remedies,gharelu nuskhe,4 rashiya,16 novmbar,8 à¤°à¤¾à¤¶à¤¿à¤¯à¥‹à¤‚ à¤•à¥€ à¤²à¤—à¥‡à¤‚à¤—à¥€ à¤²à¥‰à¤Ÿà¤°à¥€"
"how to grow hair fast,how to grow hair faster,how to grow long hair,how to grow long hair fast,how to grow long hair naturally,hair growth tips,hair grow remedies,hair growth remedies,hair growth remedies in hindi,homemade solution for hair,balo ko lamba karne ka tarika,balo ko lamba karne ka upay,balo ko lamba karne ka tarika hindi me,balo ko lamba ghana kaise kare,balo ko lamba ghana karne ka tarika,balo ko kala lamba ghana karne ke upay"
"5-Minute Crafts,DIY,Do it yourself,crafts,trucos,trucos de belliza,proyectos faciles,useful things,lifehacks,tricks,tips,DIY projects,DIY activities,Handcraft,Tutorial,easy life hacks,simple life hacks,soap,clean,clean hands,beauty hacks,hair,sugar,sugaring,sugaring at home,diy sugaring paste,flowers,fresh flowers,you do wrong,you do right,band aid,tie laces,sneakers,cleaning hacks,save time,fast,faster"
"divya priyank,divya priyank break up,divya announces official break up with priyank,divya breaks up with priyank,divya agarwal priyank sharma break up,divya priyank splitsvilla,priyank bigg boss fights,priyank bigg boss 11,divya priyank interview,divya priyank rapid fire,divya breaks down splitsvilla,bigg boss 11 full episodes,splitsvilla 10 full episode,divya priyank love story,bigg boss 11 controversies"
"Adda 247,bankersadda,bankers adda,ssc adda,sscadda,ibps,bank po,SSC,SSC CGL,adda247,adda,banking,po,government exam,bank exam,banking classes,competitive exam,sbi po,rrb,lic,railways,upsc,self preparation,imprtant topic,english classes,grammar claasses,anchal sharma,ibps clerk pre,sentence improvement,english grammar"
"etv shows,eenadu television,padutha theeyaga,super2,dhee Jodi,jabardasth,extra jabardsth,etv20,etv comedy show,extra jabardasth,naga babu,roja,anchor anasuya,rashmi,dhanraj,chandra,venu,chanti,dhana dhan dhanraj,comedy short films,chamak chandra,chalaki chanti,raghava,rocket raghava,roller raghu,venu wonders,comedy skits in telugu,telugu comedy tracks,kiraak rp"
[none]
"The Late Show,Stephen Colbert,Colbert,Late Show,celebrities,late night,talk show,skits,bit,monologue,The Late Late Show,Late Late Show,letterman,david letterman,comedian,impressions,CBS,joke,jokes,funny,funny video,funny videos,humor,celebrity,celeb,hollywood,famous,James Corden,Corden,Comedy"
"kuladheivam,kuladheivam 14.11.2017.,kuladheivam episode 772â€ suntv kuladheivam 14/11/2017.,kuladeivam sun tv serial,kuladheivam new serial,kuladheivam new sun tv serial,kuladheivam nadhaswaram replacement,nadhaswaram,thiru tv,kulatheivam 14.11.2017.,kuladheivam 14-11-17.,kulatheivam episode 772â€ SUN TV SERIAL,kuladheivam today,kulatheivam today,kuladheivam yesterday,kulatheivam yesterday,kulatheivam serial 14.11.2017,thirupictures,thirumurugan,thirutv"
"Tn Politics Updates,Tamil Nadu News,Tamil Nadu Politics,Tamil Nadu Updates,Latest TN politics,Latest Tamil News Tamil News Polimer News Polimer TV"
"my tv,14 nov 2017,nominations,shilpa shinde,Vikas Gupta,Bigg Boss 11,Hina Khan,Shilpa Shinde,Hiten Tejwani,Puneesh Sharma,Bandgi Kalra,Akash Dadlani,Bigg Boss,Arshi Khan,bigg boss 11 full episode,salman khan,full episode,bigg boss fight,vikas gupta,bigg boss 11 today episode,bookmytv,bigg boss latest episode,bigg boss nominations episode,vikas and shilpa nominations,bigg boss 14 nov,Massive fight between Akash and Hiten,akash and hiten fight"
