"samantha,naga chaitanya,samantha ruth prabhu,akkineni naga chaitanya,Samantha Naga Chaitanya Wedding Reception,Samantha Naga Chaitanya Wedding Reception Video,Samantha Naga Chaitanya Wedding,samantha naga chaitanya reception video,samantha wedding reception video,chiranjeevi,akhil akkineni,nagarjuna akkineni,ram charan,allu arjun,allu sneha,venkatesh,rana,raashi khanna,lavanya tripathi,lakshmi manchu,rakul preet,nani,ss rajamouli,brahmanandam,varun tej"
"Current Affairs Live,13 Nov 2017,à¤•à¤°à¤‚à¤Ÿ à¤…à¤«à¥‡à¤¯à¤°à¥à¤¸ à¤²à¤¾à¤‡à¤µ,All Competitive Exams"
"calvary temple,shalom,shalom calvary temple,calvary temple hyderabad,p sathish kumar,bro p sathish kumar,p sathish kumar speeches,p sathish kumar messages,calvary temple sunday services,sunday services in calvary temple,calvary temple mega youth festival,devunitho oka rather,p sathish kumar songs,jesus christ,jesus songs,jesus christ story,prabhu songs,p sathish kumar varthamanams,calvary temple images,calvary temple construction,programs at calvary temple"
"TV9 EntertainmentTelugu film news,Tollywood upcoming films,Telugu new movies,Latest film updates,Tollywood Roundup,Telugu film teaser,Latest theatrical trailer,Tollywood Top News,Navdeep on Drugs and Bigg Boss - TV9 Exclusive,navdeep drugs,navdeep videos,navdeep controversial videos,navdeep bigg boss videos,navdeep short film,navdeep web series,mana mugguri love story,navdeep in mana mugguri love story"
[none]
"Real Fight Between Hero Rajendra Prasad and Victory Venkatesh,venkatesh hero,rajendra prasad,rajendra prasad venkatesh fight,venkatesh film chanti,rajendra prasad missed hit movies,hiot movies missed by hero rajendra prasad,tollywood mirapakai,hero rajendra prasad issue with venkatesh,tm,tollywood heroes real life icidents"
"kannada bigg boss season 5,kannada bigg boss 5,bigg boss kannada season 5,bbk 5,ashita bigg boss,bigg boss season 5 ashitha,ashitha in bigg boss kannada,bigg boss ashitha jagan,jagan and ashitha"
"Rajkummar Rao,Kriti Kharbanda,Shaadi Mein Zaaroor Aana,Shaadi Mein Zaaroor Aana movie,Shaadi Mein Zaaroor Aana songs,rajkummar rao movie,newton,rajkummar & kangana,Zoom,ZoomDekho,2017 Bollywood News,Zoom TV,Bollywood Celebs,Gossips,Latest News,full interview,shaadi mein zaroor aana interview"
"Askar Ali,Aju Vargheese,Sudheer Karamana,Dharmajan,Vishak Nair,Adhiti Ravi,Parvathi Arun,Arun Vaiga,Chembarathippoo,Latest Malayalam Movie"
"Ondraga Entertainment,Lakshmi Tamil Short Film,Lakshmi Short Film,Lakshmi Tamil Short,Sarjun KM,Sundaramurthy KS,Lakshmi Priyaa Chandramouli,Nandan,Leo Sivadass,Lakshmi Priyaa,Tamil Short Films,Lakshmi Award Winning Tamil Short Film,Bharathi,Divo,Short Films,Kallappadam,Kalam,Salt Mango Tree,salt mango tree full movie,salt mango tree comedy,Kalam Tamil movie,lakshmi short film heroine,lakshmi kathir,lakshmi sekar,Award Winning Tamil Short Films"
"Viacom18,Viacom 18 Movies,Viacom 18 Motion Pictures,Viacom,Viacom Movies,sanjay leela bhansali,Padmavati"
"Natural Health Care,à°¸à±‹à°®à°µà°¾à°°à°‚ à°ˆ à°ªà°¾à°Ÿà°²à± à°µà°¿à°‚à°Ÿà±‡ 1000 à°¸à°¾à°°à±à°²à± à°•à°¾à°¶à±€ à°µà±†à°³à±à°²à°¿à°¨à°‚à°¤ à°ªà±à°£à±à°¯à°‚ à°¦à°•à±à°•à±à°¤à±à°‚à°¦à°¿ , Lord Shiva Telugu Bakthi Songs,à°¸à±‹à°®à°µà°¾à°°à°‚ à°ˆ à°ªà°¾à°Ÿà°²à± à°µà°¿à°‚à°Ÿà±‡ 1000 à°¸à°¾à°°à±à°²à± à°•à°¾à°¶à±€ à°µà±†à°³à±à°²à°¿à°¨à°‚à°¤ à°ªà±à°£à±à°¯à°‚ à°¦à°•à±à°•à±à°¤à±à°‚à°¦à°¿,à°¸à±‹à°®à°µà°¾à°°à°‚,à°ªà°¾à°Ÿà°²à±,à°•à°¾à°¶à±€,à°ªà±à°£à±à°¯à°‚,Lord Shiva,Telugu Bakthi Songs,Bakthi Songs,Shiva,Karthika Masam,Lord Siva Devotional Songs,Lord Siva Devotional,Devotional Songs,shiva sambo,shivudi patalu,god shiva,sri sailam shiva,kaasi shiva,shiva pooja,shiva trance,siva tunder,shiva"
"Reporter live,Malayalam News,News Live tv,Trending News,Malayalam News channel live,Nikesh Kumar,Editors Hour,Latest News,Latest Malayalam News,Asianet News,Manorama News,John Brittas,CPIM,kpcc,pinaray vijayan,Ente chora thilaykkunnu"
"kannada actor master manjunatha,current job of master manjunath,kannada latest news,actors who left industry,master,sandalwood star updates,chandanavana"
[none]
"rain in chennai,redpix,red pix,red pix 24x7,heavy rains in chennai,heavy rain in chennai,chennai weather,chennai rains,weather in chennai,chennai,chennai weather report,heavy rain,tamil latest news,chennai live weather,heavy rainfall warning,very heavy rain,rainfall status,city weather,chennai city,tamil news today,cyclone,tamil,news in tamil,tamil news,latest tamil news,today tamil news,tamil live news,today news tamil,live news tamil,tamilnews"
"Baat Ka Batangad,Truth,Truth Behind The Relationship,Love,Reality,Reality Behind The Relationship,Irahul Vohra,Irahul Vohra Vines,Irahul Vohra videos,Romance,Love Life,Comedy,Girl Vs Boy,Fight"
[none]
Gujrat à¤šà¥à¤¨à¤¾à¤µ à¤•à¤¾ internal à¤ªà¥‹à¤² à¤¦à¥‡à¤–à¤•à¤° à¤¹à¤¿à¤² à¤œà¤¾à¤à¤—à¥€ à¤­à¤¾à¤œà¤ªà¤¾
"usha,piriyamanaval serial,sun tv,chinnaththirai seithigal,à®šà®¿à®©à¯à®©à®¤à¯à®¤à®¿à®°à¯ˆ à®šà¯†à®¯à¯à®¤à®¿à®•à®³à¯,à®µà®¿à®œà®¯à¯ à®Ÿà®¿à®µà®¿,à®šà®©à¯ à®Ÿà®¿à®µà®¿,à®µà®¿à®œà¯‡ à®®à®•à¯‡à®¸à¯à®µà®°à®¿,vj à®®à®•à¯‡à®¸à¯à®µà®°à®¿,à®¤à¯Šà®•à¯à®ªà¯à®ªà®¾à®³à®¿à®©à®¿,à®•à®®à®²à¯,anchor mageswari,à®ªà¯Šà®´à¯à®¤à¯à®ªà¯‹à®•à¯à®•à¯,à®šà®¿à®©à®¿à®®à®¾,à®šà®©à¯ à®®à®¿à®¯à¯‚à®šà®¿à®•à¯ pd,dd,à®µà®¿à®œà®¯à¯ à®Ÿà®¿à®µà®¿ à®¤à¯Šà®•à¯à®ªà¯à®ªà®¾à®³à®¿à®©à®¿,à®µà®¿ à®œà¯† à®ªà®¿à®°à®¿à®¯à®¤à®°à¯à®·à®¿à®©à®¿,chinnathirai seithigal,poluthupokku,cenima,à®µà®¾à®´à¯à®•à¯à®•à¯ˆ,à®šà®žà¯à®šà¯€à®µà¯ à®ªà¯€à®°à¯à®¤à¯à®¤à®¿,à®šà¯€à®°à®¿à®¯à®²à¯,à®¨à®Ÿà®¿à®•à¯ˆà®•à®³à¯,à®¨à®Ÿà®¿à®•à®°à¯à®•à®³à¯,à®œà¯€ à®¤à®®à®¿à®´à¯,vj à®ªà®¿à®°à®¿à®¯à®¾,à®ˆà®¸à¯à®µà®°à®¿,à®ªà®¿à®°à®¿à®¯à®®à®¾à®©à®µà®³à¯"
"warangal diaries,latest,funny,comedy,Balajimovies,shalimar,vines,funny salesmen everywhere,funny salesmen scenes,types of salesmen,kinds of salesmen,characters of salesmen,salesmen,Hyderabadi salesmen,funny hyderabadi salesmen,funny hyderabadi,hyderabadi comedy,salesmen in hyderabad,warangal diaries new video,warangal diaries latest video,nabeel afridi,salesmen everywhere,salesmen everywhere in india,funny salesmen"
"TOP10STAR,TOp 10 STAR,8 Bollywood Actresses who become early age moms before Turning 30!,Bollywood Actresses who become moms,early age moms,before Turning 30!,Actresses beacome mom before 30 age,before 30 age,Bollywood,Actresses,early age,Kajol,dimple kapadia,twinkle khanna,Mira rajput,Actresses moms,early moms,young mother,early mother,Mother before 30 age,mother,Bollywood mom"
"IT Raid,Income tax raid,Sasikala and family,Vivek Jeyarajam,Elavarasi,Sudden income tax raid at sasikala place,JV Breaks,Junior vikatan breaks,vikatan,vikatan webtv"
"iphone x,iphone 10,iphone vs note"
"Cinema Politics,Latest Videos,Latest Gossips,jagan,ys jagan,ap,andhra pradesh,ap assembly live,ap assembly,ap assembly sessions,ap assembly budget,ap assembly budget sessions,chandrababu,chandrababu naidu,jagan speech,ys jagan speech,jagan in assembly,ys jagan assembly,amaravati,velagapudi,ap new assembly,Assembly,Vishnu Kumar Raju,Mla Vishnu Kumar Raju,politics,amaravathi,andhra pradesh assembly,praja sankalpa yatra,padayatra,winter session"
"Bigg Boss kannada 5 Grand Opening,Bigg Boss kannada 5,Bigg Boss kannada 5 opening,Bigg Boss 5 opening sudeep,bigg boss kannada season 5 contestants list,bigg boss kannada 5 contestants,bigg boss kannada 5 audition,bigg boss kannada,bigg boss sudeep,bigg boss sudeep angry,bigg boss sudeep entry,bigg boss sudeep salary,sudeep,kannada bigg boss,kannada bigg boss season 5,bigg boss kannada elimination"
"Nakkheeranwebtv,Nakkheeran webtv,ttv thinakaran,ttv,ttv thinakaran IT raid,IT raid,it raid in jaya tv,jaya tv,it raid in chennai,it raid in 180 places,it raid in ttv house,ttv thinakaran press meet,ttv thinakaran speech,aiadmk,ops,eps,o panneerselvam,edappadi palaniswamy,admk trolls,bjp,bjp trolls,modi,dmk,bjp+dmk,modi met karunanidhi,h.raja,tamilisai,income tax raid,it raid at jaya tv premises,jaya tv premises,anuradha dinakaran,jaya tv it raid"
"mor music company,mor music,mor haryanvi,new comedy,new haryanvi comedy,haryanvi comedy 2017,latest comedy,desi comedy,dehati comedy,vijay varma,shikha raghav,andy dahiya,new haryanvi video,2017 new comedy,mangu ke drame,every friday,new desi comedy"
"5 amazing signs world end,amazing facts about world,amazing facts about end of the world,end of the world in tamil,major signs for world end,amazing science facts,world fact tamil,Earth fact tamil"
"à¤•à¥à¤‚à¤­ à¤°à¤¾à¤¶à¤¿,Astro,rashi,à¤•à¥à¤‚à¤­,jansatta"
"Ippadai Vellum,Ippadai vellum review,Ippadai vellum movie review,Movie review iPPADAI Vellum,Tamil Movie review Ippadai Vellum,Tamil New Movie Review,Udhayanidhi Stalin Movie Ippadai,Ippadai movie dumbest review,Ippadai Vellum smile settai review,Ipadai velum smile settai review,Smile settai dumbest review,Ippadai Movie review,Ippadai Review,Tamil Movie Ippadai Vellum"
[none]
"à²…à²—à³à²¨à²¿à²¸à²¾à²•à³à²·à²¿ à²¸à³€à²°à²¿à²¯à²²à³ à²®à²¾à²¯à²¾ à²¤à²¾à²¯à²¿-à²•à³‚à²¡,Agnisakshi Serial Maya,Agnisaksh,maya,chandrika,voot,bigg boss,colors kannada,Agnisakshi Serial Maya Mother Famous,à²…à²—à³à²¨à²¿à²¸à²¾à²•à³à²·à²¿ à²§à²¾à²°à²¾à²µà²¾à²¹à²¿ à²…à²­à²¿à²®à²¾à²¨à²¿à²—à²³à²¿à²—à³† à²¬à³†à²šà³à²šà²¿ à²¬à³€à²³à³‹ à²¸à³à²¦à³à²¦à²¿ à²•à³Šà²Ÿà³à²Ÿ à²¸à²¿à²¦à³à²¦à²¾à²°à³à²¥à³,agnisakshi kannada serial yesterday episode,agnisakshi serial,agnisakshi kannada serial,anjali,sandalwood news,agnisakshi,sannidhi,vijay surya hero kannada,trending news,news in kannada,viral videos,kiccha sudeep,agnisakshi news"
"Flipkart Billion Capture+,Flipkart Billion Capture+ Unboxing,Flipkart Billion Capture+ review,Flipkart Billion Capture+ India,Flipkart Billion Capture+ price,Flipkart Billion Capture+ camera,Flipkart Billion Capture+ features,Flipkart Billion Capture+ hindi,Flipkart Billion Capture+ vs Xiaomi Mi A1,Xiaomi Mi A1 killer,Flipkart Billion Capture+ vs g5s plus,flipkart phone,billion phone,made in india,xiaomi killer,flipkart phone unboxing"
"Demonetization song,Demonetization anthem,#DemonetizationAnthem,Demonetisation Anthem,STR Song,STR Demonetisation song,Simbhu Demonetization song,STR demonetisation songs,STR Album,Thatrom Thookurom anthem,Thatrom Thookuram,STR Beep song,Simbu demonetisation song,Sinbhu song demonetisation,Simbu new song,Simbhu anthem,Simbhu demonetisation anthem,No cash song,Simbhu No cash song,STR Demonetization songs,Simbu songs"
"tamil cinema review,tamil cinema review prashanth,tamil cinema review prashanth latest,itisprashanth review"
"Kumar Films,Punjabi Movies,Latest Punjabi Movies,ravneet singh,jattan wale gaane,jattan,gaane,parmish verma,ravneet,singh,jattan wale songs,jatt songs,jatt,songs"
"Kundali Bhagya,Kundali Bhagya Location Shoot,Kundali Bhagya Episode,Kundali Bhagya News,Abhi and Pragya,Kundali Bhagya Updates,Zee Tv,Indian Drama,Indian Serial,Indian Show,Hindi Drama,Kundali Bhagya Scenes,sriti jha,shabbir ahluwalia,Shraddha Arya,Dheeraj Dhoopar,Preeta And Karan Kissing Romance Scenes,Kundali Bhagya 10th November 2017,Shrishti And Karan,Preeta And Rishab,Kundali Bhagya Full Episode 10th November 2017"
"amaravathimedia,YS Jagan Padayatra,YS jagan Praja sankalpayatra,YS jagan Padayatra Latest News,YS Jagan Padayatra Schedule,YS Jagan Padayatra Highlights,EX MP Undavalli Arun Kumar,EX MP Undavalli to join YCP,YSRCP,YS Jagan Padayatra special,AP Politics,EX MP Undavalli comments on CM Chandrababu Naidu,Undavalli Arun Kumar Speech,Undavalli Arun Kumar Interview,Undavalli Arun Kumar to Join YCP,Undavalli demand on Polavaram,#YS Jagan"
"zee telugu,Muddha Mandaram,full episode,telugu,show,serial,daily soap,ozee,watch online,television"
"aajtak,aaj tak,aaj tak videos,aajtak news,hindi news,news video,latest news,aajtak tv,aajtak channel news,à¤†à¤œ à¤¤à¤•,gujarat elections,bjp,congress,gujarat,gujarat assembly elections,gujarat elections 2017,rahul gandhi,breaking news,pm modi,narendra modi,gujarat polls,modi,news,gujarat election 2017,gujarat news,elections,politics,india,gujrat election,gujarati news,hardik patel,india news,à¤•à¤¾à¤‚à¤—à¥à¤°à¥‡à¤¸,top news"
"Put Chutney,Put,Chutney,South Side Stories,South,India,Demonetization,Narendra Modi,Namo,Common Man,Public Servicee,Citizen of India,Live News,Latest Trailers,Aadhar Card Scam,digital India,Modi Speech,Common Man Questions Modi,Badhil Kelvigal,Tamil News,Latest News,Latest Trailer,Addhar Card,pm modi,note ban,congress,breaking news,india news,narendra modi,kavita,demonetisation youtube,demonetisation comedy"
"latest news in malayalam,malayalam news,malayalam news live,asianet,asianet news,Latest malayalam news,RSS worker,hacked to death"
[none]
"zee tv,Kundali Bhagya,full episode,hindi,show,serial,daily soap,ozee,watch online,television"
"tona totka,tone,laal kitaab,lal kitaab,pandit ji talk,chamatkari samsya,chamatkari upay,à¤˜à¤° à¤®à¥‡à¤‚ à¤šà¥à¤ªà¤šà¤¾à¤ª à¤¯à¤¹à¤¾à¤ à¤°à¤– à¤¦à¥‡ à¤à¤• à¤²à¥Œà¤‚à¤—,à¤‡à¤¤à¤¨à¤¾ à¤¬à¤°à¤¸à¥‡à¤—à¤¾ à¤ªà¥ˆà¤¸à¤¾ à¤•à¤¿ à¤†à¤ª à¤¸à¤‚à¤­à¤¾à¤² à¤¨à¤¹à¥€à¤‚ à¤ªà¤¾à¤“à¤—à¥‡,ayurvedic,ayurevda,home treatment,home remedies,gharelu nuskhe"
"Dialogue Promo,Shaadi Abhi Baaki Hai,Waqt Itna Bhi Song,Jab Tum Male Version,Shaadi Abhi Baaki Hai Movie,Shaadi Abhi Baaki Hai Songs,Ji Ne Meriye song,Zee Music Company,latest songs,new songs,new movie songs,hindi songs,superhit songs,zee music hit songs,party songs,romantic songs,love songs,latest bollywood movies,Bollywood movie songs,Shaadi Abhi Baaki Hai songs,Shaadi Abhi Baaki Hai movie songs,zee music company"
"aromalar,trollrepublic,trollmalayalam,trollvideos,funnyvideos,aromaltroll,trollaromal"
"Malayalam 2017 songs,Malayalam latest music,Malayalam Short Films,Best Malayalam Short Films,Best Short Films,Malayalam Short Movies,Anna,Anna Short Film,Anna Malayalam Short Film,Romantic Short Films,Romantic Malayalam Short Films,Love Story,Malayalam Love Stories,Eldhose Lomy"
"Shri Devkinandan ji,à¤¦à¥‡à¤µà¤•à¥€à¤¨à¤‚à¤¦à¤¨ à¤œà¥€ à¤®à¤¹à¤¾à¤°à¤¾à¤œ à¤•à¥€ à¤•à¤¥à¤¾,Shrimad Bhagvat katha Audio,shrimad bhagvat katha,thakur ji ke bhajan mp3"
[none]
"Chirravuri,Foundation,telugu devotional,chirravuri foundation,jayam,lakshmi,pooja,puja,bhakti,deepam,usiri,vusiri,panchamgam,karthika masam,sri chirravuri jayam,problem,pravachanam,problems,solution,ism,om,astrology,money,family problems,speech,jathakam,archana,devi,remedies,lakshmi devi,telugu astrology,upload,hindu,spiritual,latest,chirravuri krishna kishore,krishna kishore,healing,tips,mantra,new,health problems,chirravuri remedies,garikapati,hinduism,friday,rich,riches"
"shaadi mein zaroor aana,rajkummar rao,kriti kharbanda,shaadi mein zaroor aana songs,zee music company,arre,arre videos,arre funny videos,funny videos,arre comedy videos,shadi mein zaroor aana arre video,arre rajkummar rao,arre kriti kharbanda,new bollywood movies,new r rajkummar rao movies,rajkummar rao new movie,rajkummar rao kriti kharbanda,new upcoming movies,the pallo song,pallo latake,the paloo song,Every Arranged Marriage Ever"
"Athadu Aame (He & She),Latest Telugu Comedy Web Series,Season 3,Episode 3,Chandragiri Subbu,Shh! Oka Secret Cheptha,Athadu Aame Web Series,Athadu Aame Comedy Web Series,Athadu Aame Latest Telugu Web Series,Athadu Aame Telugu Comedy Web Series,Web Series,Telugu Web Series,Latest Telugu Web Series,Comedy Web Series,Latest Comedy Web Series,Funny Web Series,Comedy Videos,Latest Comedy Videos,Latest Funny Videos,Telugu Comedy Videos"
[none]
"à²¨à²®à³à²® à²•à²¨à³à²¨à²¡ à²Ÿà²¿.à²µà²¿. Namma Kannada TV,Sandalwood Latest News,Kannada Latest News,Kannada Movies 2017,à²—à³Šà²¤à³à²¤à²¿à²²à²¦à³† 2 à²µà²°à³à²· à²ªà²¿à²¶à²¾à²šà²¿ à²œà³Šà²¤à³† à²¸à²‚à²¸à²¾à²° à²®à²¾à²¡à²¿ à²®à²—à³ à²•à³‚à²¡ à²®à²¾à²¡à²¿à²•à³Šà²‚à²¡,kannada unknown facts,men with pisachi,2 years,interesting facts,kannada tv"
[none]
"All India Bakchod,AIB,AllIndiaBakchod,Tanmay Bhat,Gursimran Khamba,Rohan Joshi,Ashish Shakya,AIB latest video,AIB new video,Comedy,Sketch Comedy,Sketch,Funny,Indian comedy,Funny Video,Bollywood,dil wale dulhaniya le jayenge,Dangal,Dil Chahta Hai,Rock On,Zindagi Na Milegi Dobara,Kabhi Khushi Kabhi Gham,Race,Dhoom,Dhoom 2,Dhoom 3,Hum Saath Saath Hai"
"sharry mann,sharry mann new song,sharry mann cute munda,sharry mann latest song,sharry mann punjabi song 2017,parmish verma,parmish verma new song,parmish verma sharry mann,parmish verma sharry mann new song,parmish verma cute munda,new punjabi song 2017,punjabi song 2017,parmish verma new song 2017,parmish verma latest song 2017,punjabi songs 2017"
"à¤ªà¥€à¤°à¤¿à¤¯à¤¡à¥à¤¸ à¤•à¥‡ à¤¸à¤®à¤¯,à¤ªà¥‡à¤Ÿ à¤ªà¤° à¤ªà¤¤à¤¿ à¤•à¤°à¤¤à¤¾ à¤à¤¸à¤¾,à¤¦à¥‡à¤–à¤•à¤° à¤¦à¤‚à¤— à¤°à¤¹ à¤œà¤¾à¤¯à¥‡à¤‚à¤—à¥‡,latest news,today news,news,breaking news,current news,world news,hj news updates,bollywood updates,news channel in hindi,entertainment news,merrage,love,break up,perideus time,pragenent girl,baby born"
"Filmylooks,latest news,telugu movies,telugu news,Tollywood news,why Samantha became EMOTIONAL @ Samantha naga chaithanya marriage Reception,why Samantha became EMOTIONAL,samantha emotional moment,ChaySam Wedding Reception video,Naga Chaitanya and Samantha Wedding Reception LIVE,samantha ruth prabhu"
"Car,Couple,Couple Goals,Planing to buy a new car,Zoom Car,New Cars,Inmates,Couple fights,Wedding,Wedding Planing,Mehendi Design,Wedding Shopping,Shaadi,Marriage,Best Friend,Roomates,Girlfriend,Boyfriend,Fiance,Sangeet,Future Planning,EMI,Car EMI,Buying Car Tips,Humour,Funny Video,LOL,Comedy,Sketch,Listicle"
"Chiranjeevi in Naga Chaitanya - Samantha Reception , Chaitanya,Samantha Akkineni,Nag,Venkatesh,Megastar Chiranjeevi,Megastar Chiranjeevi @ #ChaySam Wedding Reception,Chiranjeevi @ #ChaySam Wedding Reception,Naga Chaitanya - Samantha Akkineni Reception LIVE,Naga Chaitanya,Samantha,Naga Chaitanya Samantha,Nagarjuna,#ChaiSam,Reception LIVE,Akkineni Reception,chiranjeevi rama charan,naga chaitanya samantha wedding reception,Akkineni family,Daggubati family,reception"
"Pradeep Machiraju,Anchor Pradeep,pradeep machiraju,konchem touch lo unte chepta,konchem touch lo unta season 3,konchem touch lo unte cheputha latest episode,KTUC 3,KTUC Season 3,Konchem Touch Lo Unte Chepta Season 3 - Akkineni Nagarjuna,Karthi Promo,Khakee movie,Khakee movie trailer,Khakee movie songs,KTUC Karthi Promo,KTUC Karthi Rakul preeth singh promo,konchem touch lo unte cheputha karthi"
"Stylish Star Allu Arjun @ ChaySam Wedding Reception,Stylish Star Allu Arjun,ChaySam Wedding Reception,nagachaitanya,samantha,chaysam,chay sam,naga chaitanya and samantha wedding reception,wedding reception,nagarjuna,akkineni wedding reception,tfpc,telugu cinema,celebrities @ chaysam wedding reception"
"abn telugu news,abn andhrajyothy,abn andhrajyothy news,telugu news channels,live news channels,abn live news,abn news online,Telugu News,telugu news online,live tv channels,telugu news live,telangana"
"Natural Star Nani REAL Behaviour Will SHOCK You,Naga Chaitanya Samantha Reception Video,NewsQube,Nani,Nani Real Behaviour Will Shock You,Nani Behaviour Will Shock You,Nani at Samantha and Naga Chaitanya Reception,Nani at Samantha and Naga Chaitanya Wedding Reception,Samantha and Naga Chaitanya,Samantha and Naga Chaitanya Reception,Samantha and Naga Chaitanya Wedding Reception,Samantha and Naga Chaitanya Reception Video,Samantha and Naga Chaitanya Wedding Reception Video"
"punjabi songs,punjabi bhangra,punjabi music,punjabi bhangra music,punjabi latest songs,punjabi romantic songs,punjabi sad songs,punjabi,bhangra,latest punjabi songs 2017,punjab,desi,speed records,mankirt new song,daang,sukh sanghera,deep kahlon,mankirt aulakh"
"Gujarat Assembly Elections,Gujarat Elections,Gujarat Assembly Polls,Gujarat Polls,Gujarat Vidhansabha Election,Gujarat Elections 2017,BJP,Congress,Gujarat News"
"billion capture +,billion capture plus,flipkart smartphone,flipkart billion phone,flipkart phone,billion capture + unboxing,flipkart android phone,flipkart billion capture plus,flipkart bilion,Billion Capture+,Flipkart Billion Capture+,igyaan exclusive,flipkart billion capture,unboxing and hands on,review,made in india,Smart Phone,Hands on Overview,Technicalguruji,technical guruji,gaurav chaudhary,Hands on"
"Eruma Saani,Tamil Comedy Videos,Films,Movies,Harija,Short,Film,Eruma Sani,Eruma Saani Videos,Eruma Saani Short Film,Eruma Saani Comedy,Eruma Saani Harija,Eruma Saani Tamil vs English,Tamil vs English,Tamil,English,Hindi,TTV Dinakaran,Sasikala,Sasikala income tax raid"
"Asianet comedy awards 2017,comedy awards 2017,jagadeesh,rimi tomy,pisharadi,dharmajan,comedy show,comedy stars,best comedy,malayalam movie comedy,malayalam cinema,film awards,asianet comedy awards,comedy awards,jayaram,ACA,kunchacko boban,kunchacko boban dubsmash,kunjackoboban singing,vijay yesudas,kunchakko boban wife,asianet comedy,suraj,comedy skit,kunchakko rimi"
"deivamagal,deiva magal,deiva magal serial,VikatanTV,deivamagal episode today,deivamagal today,deivamagal today episode,deivamagal episode 1388,deivamagal 14 November 2017,deiva magal serial 14.11.17,deiva magal episode 1388,à®¤à¯†à®¯à¯à®µà®®à®•à®³à¯,devamagal,deivamagal episode,deviamagal,deivamahal,devaimagal,divamagal"
[none]
"flat,girls,women,flatmates,fight,love,hate,group,mostlysane,nidhi bisht,food,foodporn,money,srishti"
"Nakkheeranwebtv,Nakkheeran webtv,sasikala raid,sasikala family raid,it raid,ttv dinakaran speech,sasikala jail,aiadmk,tamil news,tamil political news,sasikala natarajan,sasikala old,jayalalitha story,poes garden house,jayalalitha sasikala,bjp,narendara modi,income tax,nakkheeran gopal new video,nakkheeran gopal about IT raid,nakkheeran gopal,nakkheeran exclusive,income tax raid,sasikala,family,friends"
"chunks honeyrose song,chunkzz video song,Ithu Nava Sumashara,Ithu Nava Sumashara video song,honey rose glamour song,chunkzz malayalam movie,Ithu Nava Sumashara honey rose,honey rose,omar lulu,gopi sundar,honey rose in chunkzz,chunks video song,chunkss video song,Ithu Nava Sumashara hone rose song,honey rose latest,gopi sundar latest,honey rose latest song,chukzz full songs,gopi sundar bgm,gopi sundar chunkzz,chunkzz movie,chunks,dq,chunkzz full songs"
"Ek Dil Ek Jaan Video Song,Ek Dil Ek Jaan,Ek Dil Ek Jaan Video,Padmavati,Padmavati songs,Padmavati movie song,deepika padukone,ranveer singh,ghoomar,padmavati song,Deepika Padukone,Shahid Kapoor,Sanjay Leela Bhansali,Padmavati Deepika Padukone,Ghoomar,Ghoomar Deepika Padukone,Padmavati Songs,new hindi songs,hindi songs,shahid kapoor,sanjay leela bhansali,indian songs,padmavati songs,love song,love song 2017,do dil ek jaan"
"radhika kumarswamy latest news,radhika joining,radhika news,radhika kumarswamy family,radhika joining a new party,j d s,radhika kumarswamy new movie updates,radhika latest news,kannada latest movie news,sandalwood reviews"
"Hina khan,Hina khan bigg boss,Bigg boss 11,Big boss,Bigg boss,Bigg boss 11 eviction,Bb 11,Bigg boss season 11,Bigg boss 11 full episode,Tellymasala,Telly masala,Telly masala latest interview,Telly masala bigg boss,Mehjabi,siddiqui,mahjabi siddiqui interview,mehjabi reveals,hina khan bigg boss 11,bigg boss 11,telly masala,tellymasala bigg boss,telly masala latest interview,bigg boss full episode"
"Mersal - Maacho lyric,Mersal,Mersal Songs,Mersal Videos,Mersal Trailers,Mersal Full Song,Mersal HD Videos,Mersal Movie Songs,Mersal Official Songs,Mersal Official Videos,Mersal Official Movie Videos,Mersal Official HD Songs,Mersal Official HD Videos,Maacho Song,Maacho Video,Maacho HD Song,Maacho HD Video,Maacho Movie Song,Maacho Movie Video,Maacho HD Movie Song Video,Maacho Official Song,tamil hit songs,Tamil love songs"
