"sharry mann,sharry mann new song,sharry mann cute munda,sharry mann latest song,sharry mann punjabi song 2017,parmish verma,parmish verma new song,parmish verma sharry mann,parmish verma sharry mann new song,parmish verma cute munda,new punjabi song 2017,punjabi song 2017,parmish verma new song 2017,parmish verma latest song 2017,punjabi songs 2017"
"à¤ªà¥€à¤°à¤¿à¤¯à¤¡à¥à¤¸ à¤•à¥‡ à¤¸à¤®à¤¯,à¤ªà¥‡à¤Ÿ à¤ªà¤° à¤ªà¤¤à¤¿ à¤•à¤°à¤¤à¤¾ à¤à¤¸à¤¾,à¤¦à¥‡à¤–à¤•à¤° à¤¦à¤‚à¤— à¤°à¤¹ à¤œà¤¾à¤¯à¥‡à¤‚à¤—à¥‡,latest news,today news,news,breaking news,current news,world news,hj news updates,bollywood updates,news channel in hindi,entertainment news,merrage,love,break up,perideus time,pragenent girl,baby born"
"Stylish Star Allu Arjun @ ChaySam Wedding Reception,Stylish Star Allu Arjun,ChaySam Wedding Reception,nagachaitanya,samantha,chaysam,chay sam,naga chaitanya and samantha wedding reception,wedding reception,nagarjuna,akkineni wedding reception,tfpc,telugu cinema,celebrities @ chaysam wedding reception"
"Eruma Saani,Tamil Comedy Videos,Films,Movies,Harija,Short,Film,Eruma Sani,Eruma Saani Videos,Eruma Saani Short Film,Eruma Saani Comedy,Eruma Saani Harija,Eruma Saani Tamil vs English,Tamil vs English,Tamil,English,Hindi,TTV Dinakaran,Sasikala,Sasikala income tax raid"
"Filmylooks,latest news,telugu movies,telugu news,Tollywood news,why Samantha became EMOTIONAL @ Samantha naga chaithanya marriage Reception,why Samantha became EMOTIONAL,samantha emotional moment,ChaySam Wedding Reception video,Naga Chaitanya and Samantha Wedding Reception LIVE,samantha ruth prabhu"
"Nenu Local,Nenu Local Telugu Movie,Nani,Sai Pallavi,Dil Raju,Devi Sri Prasad,Telugu Latest Movies,Telugu Full Movies,Telugu Comedy Movies,Nani Trailer,Nani Movies,MCA MOVIE,Middle Class Abbayi,MCA,MCA - Middle class abbayi,Fidaa,Nani MCA,MCA Trailer,MCA Teaser,MCA First Look,Nani MCA Teaser,Nani MCA Trailer"
"punjabi songs,punjabi bhangra,punjabi music,punjabi bhangra music,punjabi latest songs,punjabi romantic songs,punjabi sad songs,punjabi,bhangra,latest punjabi songs 2017,punjab,desi,speed records,mankirt new song,daang,sukh sanghera,deep kahlon,mankirt aulakh"
"Ek Dil Ek Jaan Video Song,Ek Dil Ek Jaan,Ek Dil Ek Jaan Video,Padmavati,Padmavati songs,Padmavati movie song,deepika padukone,ranveer singh,ghoomar,padmavati song,Deepika Padukone,Shahid Kapoor,Sanjay Leela Bhansali,Padmavati Deepika Padukone,Ghoomar,Ghoomar Deepika Padukone,Padmavati Songs,new hindi songs,hindi songs,shahid kapoor,sanjay leela bhansali,indian songs,padmavati songs,love song,love song 2017,do dil ek jaan"
"Chiranjeevi in Naga Chaitanya - Samantha Reception , Chaitanya,Samantha Akkineni,Nag,Venkatesh,Megastar Chiranjeevi,Megastar Chiranjeevi @ #ChaySam Wedding Reception,Chiranjeevi @ #ChaySam Wedding Reception,Naga Chaitanya - Samantha Akkineni Reception LIVE,Naga Chaitanya,Samantha,Naga Chaitanya Samantha,Nagarjuna,#ChaiSam,Reception LIVE,Akkineni Reception,chiranjeevi rama charan,naga chaitanya samantha wedding reception,Akkineni family,Daggubati family,reception"
"Jump cuts,Jumpcuts,Tamil comedy,Tamil Comedy Videos,new bike vs old bike,jumpcuts reality,the reality,bike scenario jumpcuts,jumpcuts bike story,hari baskar videos,hari baskar jumpcuts,hari baskar bike video,tamil viral videos,viral videos,trending videos,jumpcuts trending videos,swathi videos,kaghs,jumpcuts old vs new,jumpcuts tamil comedy,jumpcuts youtube channel,hot story jumpcuts,hot scenario"
"Hina khan,Hina khan bigg boss,Bigg boss 11,Big boss,Bigg boss,Bigg boss 11 eviction,Bb 11,Bigg boss season 11,Bigg boss 11 full episode,Tellymasala,Telly masala,Telly masala latest interview,Telly masala bigg boss,Mehjabi,siddiqui,mahjabi siddiqui interview,mehjabi reveals,hina khan bigg boss 11,bigg boss 11,telly masala,tellymasala bigg boss,telly masala latest interview,bigg boss full episode"
"Aatish new punjabi song 2017,latest punjabi songs 2017 Aatish,new punjabi songs 2017 Jannat,latest punjabi song 2017 Jannat,new songs 2017 Aatish,latest song 2017 Aatish,Aatish,punjabi songs 2017 Aatish,punjabi music videos Aatish,Jannat punjabi song 2017,new punjabi songs,latest punjabi songs,new songs,latest songs,songs 2017,punjabi,Aatish songs,Jannat by Aatish,punjabi song,whte hill,aatish taare,romantic songs punjabi"
"Resnu desai,actress renu desai,pawan kalyan wife renu desai,pawan kalyan ex-wife renu desai,ABN renu desai interview,renu desai open heart with RK,renu desai rates pawan kalyan,renu desai rates 10 for pawan,renu desai rates pawan kalyan as husband,renu desai interview,RK interview with renu desai,renu desai interview with RK,ABN,ABN Telugu,ABN News,ABN andhrajyothy,ABN andhrajyothi,renu desai open heart,renu commentson pawa kalayna,renu desai interivew"
"the voice of india,TVOI,the voice of india kids,audition,singers,singing talent,kids voice,kids singing,kids talent,Talpa media,AndTV,&TV"
"rowi na,nadha virender,prabh grewal,latest punjabi songs 2017,new punjabi songs 2017,best punjabi songs 2017,brand new punjabi songs,punjabi songs,punjabi,songs,new,latest,rowi,na,nadha,birender,parmish verma,parmish,punjabi sad songs,punjabi love songs,punjabi romantic songs,new punjabi sad song,sad song,best sad songs,best song of the week"
"nextgen,sasikala,sasikala natarajan,aiadmk,tamil nadu,jayalalithaa,jayalalitha,tamil news,apollo hospital,sasikala pushpa,it raid,sasikala family,income tax raid,latest tamil news,latest news,politics,tamil news today,ops,tamilnadu,admk,youtube,news in tamil,tamil nadu cm,tamil,vivek,vivek jayaram,jayalalitha uyil,apollo cd it raid"
"TYPES OF STUDENTS ELVISH YADAV,elvish yadav,elvish yadav new video,elvish yadav latest video,elvish yadav vines,elvish yadav videos,students video,types of students in a class,omprakash new song,sot lagani hai,elvis yadav vines"
"Tiger Zinda Hai Trailer,Tiger Zinda Hai Official Trailer,Tiger Zinda Hai Teaser,Tiger Trailer,Trailer of Tiger Zinda Hai,Salman Khan Song,Salman Khan Movie Trailer,Bollywood Trailer,Hindi Trailer,Salman Khan Tiger Zinda Hai Trailer,Trailer 2017,Most Viewed Trailer,Official Trailer 2017,Salman Katrina Movie,Salman Khan Trailer 2017,2017 Bollywood Trailer,Official Trailer Tiger Zinda Hai,Latest Movie Trailer,Salman Khan,Katrina Kaif,Vishal and Shekhar,YRF"
"Prank Call,Funny Reactions,Pranks In India 2017,comedy video,meri setting karade live,Bhai meri bhi setting karwa funny video,tst rahul,tst rahul prince,Pranks in India,Prank on Girls,girls in love,love,friendship,dost,relationship,tst latest video,pranks,pramk on girls,funny,TroubleSeekerTeam,prank on girls,best prank on girls,best girl pranks,girl pranks,tst girls prank,indian prank,language in india,indian pranks,best indian prank,comedy"
"last week tonight trump presidency,last week tonight donald trump,john oliver trump,donald trump"
"asli fighter,asli fighter (okka ammayi thappa) 2017 hindi dubbed,okka ammayi thappa full movie hindi dubbed,sundeep kishan movies in hindi dubbed,ravi kishan south movie in hindi,nithya menon movies hindi dubbed,nithya menen,ravi kishan,rahul dev,south indian movies dubbed in hindi full movie 2017 new,latest hindi dubbed movies 2017,new release south indian movies dubbed in hindi 2017,latest 2017 south indian movies dubbed in hindi"
"etv shows,eenadu television,padutha theeyaga,super2,dhee Jodi,jabardasth,extra jabardsth,etv20,etv comedy show,extra jabardasth,naga babu,roja,anchor anasuya,rashmi,dhanraj,chandra,venu,chanti,dhana dhan dhanraj,comedy short films,chamak chandra,chalaki chanti,raghava,rocket raghava,roller raghu,venu wonders,comedy skits in telugu,telugu comedy tracks,kiraak rp"
"deivamagal,deiva magal,deiva magal serial,VikatanTV,deivamagal episode today,deivamagal today,deivamagal today episode,deivamagal episode 1387,deivamagal 13 November 2017,deiva magal serial 13.11.17,deiva magal episode 1387,à®¤à¯†à®¯à¯à®µà®®à®•à®³à¯,devamagal,deivamagal episode,deviamagal,deivamahal,devaimagal,divamagal"
"Rana hungama at #ChaySam Wedding Reception , TV9"
"Hero Tarun At Samantha Naga Chaitanya Wedding Reception,#ChaySam Reception,News Mantra,Hero Tarun@ #ChaySam Wedding Reception,Hero Tarun,Naga Chaitanya - Samantha Akkineni Reception LIVE,Naga Chaitanya,Samantha,Naga Chaitanya Samantha,Nagarjuna,#ChaiSam,Reception LIVE,Akkineni Reception LIVE,Naga Chaitanya and Samantha marriage,chaysam reception live,Naga Chaitanya Samantha Wedding reception LIVE"
[none]
"moto x4 unboxing,moto x4,moto x4 india,moto x4 hands on,noto x4 camera,moto x4 review,geekyranjit"
"Hindi Khabar,UttarPradesh,Uttrakhand,BundelKhand,AtulAgrawal,DigitalMedia,UP,Yogi Adityanath,Yogi Sarkar,à¤…à¤–à¤¿à¤²à¥‡à¤¶ à¤¯à¤¾à¤¦à¤µ,à¤®à¤¾à¤¯à¤¾à¤µà¤¤à¥€,à¤¯à¥‹à¤—à¥€ à¤†à¤¦à¤¿à¤¤à¥à¤¯à¤¨à¤¾à¤¥,à¤¬à¥€à¤œà¥‡à¤ªà¥€,à¤¸à¤ªà¤¾,à¤¬à¤¸à¤ªà¤¾,à¤•à¤¾à¤‚à¤—à¥à¤°à¥‡à¤¸,à¤•à¥‡à¤¶à¤µ à¤ªà¥à¤°à¤¸à¤¾à¤¦ à¤®à¥Œà¤°à¥à¤¯,à¤¡à¥‰. à¤¦à¤¿à¤¨à¥‡à¤¶ à¤¶à¤°à¥à¤®à¤¾,à¤²à¤–à¤¨à¤Š,à¤—à¥‹à¤°à¤–à¤ªà¥à¤°,à¤µà¤¾à¤°à¤¾à¤£à¤¸à¥€,à¤¹à¤¿à¤¨à¥à¤¦à¥€ à¤–à¤¼à¤¬à¤°,à¤¨à¤°à¥‡à¤¨à¥à¤¦à¥à¤° à¤®à¥‹à¤¦à¥€,SP,BJP,Congress,Dinesh Sharma,Keshaw Prasad Maurya"
"dreams n beyond,dreamsnbeyond,ranjith shankar,Punyalan Private Limited,Punyalan Private Limited Official Teaser 2,punyalan private limited trailer,jayasurya,aju varghese,punyalan 2 trailer,punyalan kalippu teaser,punyalan 2 teaser,punyalan 2 teaser trailer,punyalan private limited,punyalan 2 official trailer,punyalan private limited movie,punyalan private limited theatrical trailer,punyalan private limited official trailer,punyalan 2,punyalan agarbatis,dq,new"
"Nagarjuna Funny Comments on Samantha Dress,Naga Chaitany Samantha Akkineni Wedding Reception 2017,nagarjuna shocking comments on samantha dress,nagarjuna funny comments,samantha dress,samantha wedding reception,samantha,dress,nagarjuna,funny,naga chaitany,naga chaitany samantha,samantha wedding,#chaisam,akkineni reception live,grand reception for #chaysam,samantha akkineni,naga chaitanya,akkineni naga chaitanya,samantha marriage video"
"sdi,islam,preacher,sunni,sunni ijtema,ijtema 2017,Final Day,27 Annaul Ijtema"
"Neeya Naana,NN,Gopinath,Men Vs Women Series,Talk Show,Chat Show,Public Debate,Gopi,Gobi,Vijay,Star,Vijay TV,Star Vijay,Star Vijay TV,à®µà®¿à®œà®¯à¯,à®Ÿà®¿à®µà®¿,à®¤à¯Šà®²à¯ˆà®•à¯à®•à®¾à®Ÿà¯à®šà®¿,à®¨à¯€à®¯à®¾ à®¨à®¾à®©à®¾,à®•à¯‹à®ªà®¿à®¨à®¾à®¤à¯,Tamil TV,Tamil Shows,gopi"
"divya priyank,divya priyank break up,divya announces official break up with priyank,divya breaks up with priyank,divya agarwal priyank sharma break up,divya priyank splitsvilla,priyank bigg boss fights,priyank bigg boss 11,divya priyank interview,divya priyank rapid fire,divya breaks down splitsvilla,bigg boss 11 full episodes,splitsvilla 10 full episode,divya priyank love story,bigg boss 11 controversies"
"newsqube,latest Movies,telugu movie Trailers,newsqube latest news,newsqube channel,Natural Star Nani REAL Behiour Shocks You ,"
"sathiyam news today,sathiyam news live today,sathiyam tv news live,sathiyam tv news yesterday,tamil news today,tamilnadu news today live,sun news today,breaking,news,it raid,income tax,raid,sasikala,admk"
"Brahmanandam @#ChaySam Wedding Reception ,Brahmanandam @#ChaySam,Naga Chaitanya - Samantha Akkineni Reception LIVE,Naga Chaitanya,Samantha,Naga Chaitanya Samantha,Nagarjuna,#ChaiSam,Reception LIVE,Akkineni Reception LIVE,reception live ntv,ntv"
"Miracles Caught on Camera,Miracles Caught on Tape,Miracle Caught on Camera,Miracle Caught on Tape,Caught On Camera,Caught on Tape,Miracles,Miracle,Tape,Real,Life,Real Life,Viral,Camera,Caught,Miracles Caught,Life Miracle,Life Miracles,Miracles In Life,miracles caught on video,miracles caught on cctv,miracles caught on film,miracles caught on cam,Caught On Video"
"Bahubali 2,Baahubali 2 The Conclusion,Plenty Wrong With,Plenty Wrong With Bahubali 2,Bahubali 2 Mistakes,Mistakes In Bahubali,Prabhas,Anushka Shetty,Bahubali 2 Movie Mistakes,Bollywood Sins,Bahubali 2 Full Movie,PWW,Mistakes,Bollywood,Bollywood Mistakes,Baahubali Full Movie,Movie Mistakes,Plenty Wrong With Baahubali,Bollywood Sins Bahubali 2,Mistakes Bollywood,#popularonyoutubeindia,Popular Right Now India"
"Latest Punjabi Songs 2017,New Punjabi Songs 2017,Punjabi Songs 2017,Punjabi Songs,romy tahlie,romy,tahlie,rajj ke rona main,rajj ke,rona,main,rajj,ke,punjabi sad songs,best punjabi sad songs,latest punjabi songs,new punjabi songs 2017,parmish verma,guri,singh jeet,g guri"
"chunks honeyrose song,chunkzz video song,Ithu Nava Sumashara,Ithu Nava Sumashara video song,honey rose glamour song,chunkzz malayalam movie,Ithu Nava Sumashara honey rose,honey rose,omar lulu,gopi sundar,honey rose in chunkzz,chunks video song,chunkss video song,Ithu Nava Sumashara hone rose song,honey rose latest,gopi sundar latest,honey rose latest song,chukzz full songs,gopi sundar bgm,gopi sundar chunkzz,chunkzz movie,chunks,dq,chunkzz full songs"
"Date,Girls,Hot Girls,Sanskaari Girls,Boyfriend,Girlfriend,Horny,Horny Girl,Pizza,Food,Foodie,Pasta,How To Date,Emo Girl,Ex Boyfriend,Ex Girlfriend,Shaadi,Marriage,Tips For First Date,First Date,Awkward,Awkward Dates,What To Wear On A Date,Love,Romance,Date Tips,How To Ask A Girl Out,Flirt,Flirting,Komal Pandey,Funny Video,Comedy,LOL,Naughty Girl,Hot Guy"
"etv Plus,etv comedy show,3 Idiots,anchor ravi,Chinnadana Neekosam,express raja,hungama,Kick,Nandini Vs Nandini,Pataas,jabardasth,extra jabardasth,naga babu,roja,anchor anasuya,pove pora,comedy short films,yadamma raju,chalaki chanti,sudigali sudeer,anchor suma,comedy show,anchor sreemukhi,comedy skits in telugu,telugu comedy tracks,racha ravi,allare allari,sardaga kasepu,ejunction,anchor pradeep,pataas punches,anchor vishnupriya,getup srinu"
"saas bahu beti,saas bahu aur beti,saas bahu aur betiyaan,entertainment show,TV celebs,tv shows,hindi shows,entertainment videos,celeb interviews,tv actors,tv actress,popular tv actors"
"I news,i news telugu channel,i news youtube,i news channel,i news online,i news telugu online,online telugu news,telangana news,ap news,breaking news,latest telugu news,ICM KCR Slams Amit Shah,Amit Shah AP Tour,TDP Mahanadu,Sonia Gandhi,Presidential Elections,Harish Rao Slams Amit Shah,Amit Shah Praises PM Modi"
"à´¸àµ—à´¬à´¿à´¨àµ† à´µàµ†à´±àµà´‚ 30 à´¸àµ†à´•àµà´•àµ»à´¡àµ à´¸à´®à´¯à´‚ à´•àµŠà´£àµà´Ÿàµ à´µà´³à´šàµà´šàµ†à´Ÿàµà´¤àµà´¤ à´ªàµ‡àµ¼à´³à´¿ !!,Asianet comedy awards 2017,comedy awards 2017,jagadeesh,rimi tomy,pisharadi,dharmajan,comedy show,comedy stars,best comedy,best of comedy,malayalam cinema,best comedy 2017,film awards,asianet comedy awards,comedy awards,jayaram,ACA,parava,parava movie,soubin shahir,parava director,soubin,soubin shahir parava,parava scenes,parava full movie,soubin shahir movie,pearle maaney"
"the viral fever,tvf,humour,qtiyapa,permanent,roommates,barely,speaking,drama,originals,comedy,sketch,web series,tv show,netflix,amazon prime"
"Does GOD EXIST OR NOT? PART 2,Unknown Facts About GOD Revealed in Telugu,Vikram Aditya,EP#92,Does God Exist or Not,Unknown Facts about God,Shocking Facts About God,Unknown Facts About God in Telugu,Shocking Facts About God in Telugu,Latest News,Latest Updates,Vikram Aditya New videos,Vikram Aditya Videos,Vikram Aditya Latest Videos"
"Genes,Genes Show,Genes Videos,Genes Telugu Show,Genes Entertainment Show,Genes Latest Video,Genes New Video,Genes Latest Videos,Genes Telugu Videos,Suma Entertainement Show,Suma Comedy With Stars,Genes Tollywood Game Show,Genes Latest Promo,Telugu Latest Shows,Latest Promos,Telugu Promos,Suma Fun at Genes,Suma Punches,Suma Counter,Suma Funny Punches,Yadammaraju"
"Tiger Zinda Hai Trailer,Tiger Zinda Hai Official Trailer,Tiger Zinda Hai Teaser,Tiger Trailer,Trailer of Tiger Zinda Hai,Bollywood Trailer,Trailer 2017,Latest Movie Trailer,tona totka,tone,lal kitaab,pandit ji talk,chamatkari samsya,chamatkari upay,à¤˜à¤° à¤®à¥‡à¤‚ à¤šà¥à¤ªà¤šà¤¾à¤ª à¤¯à¤¹à¤¾à¤ à¤°à¤– à¤¦à¥‡ à¤à¤• à¤²à¥Œà¤‚à¤—,à¤‡à¤¤à¤¨à¤¾ à¤¬à¤°à¤¸à¥‡à¤—à¤¾ à¤ªà¥ˆà¤¸à¤¾ à¤•à¤¿ à¤†à¤ª à¤¸à¤‚à¤­à¤¾à¤² à¤¨à¤¹à¥€à¤‚ à¤ªà¤¾à¤“à¤—à¥‡,ayurvedic,ayurevda,home treatment,home remedies,gharelu nuskhe,4 rashiya,16 novmbar,8 à¤°à¤¾à¤¶à¤¿à¤¯à¥‹à¤‚ à¤•à¥€ à¤²à¤—à¥‡à¤‚à¤—à¥€ à¤²à¥‰à¤Ÿà¤°à¥€"
"bollywood news,bollywood news in hindi,bollywood box office,bollywood actress,latest bollywood news,bollywood gossip,bollywood news and gossip"
"november 2017 current affairs,november,november 2017,current,affairs,current affairs,study iq,studyiq,study,iq,best,gk,general knowledge,general,knowledge,static,static gk,upsc,ssc,cgl,chsl,lic,ldc,mts,ibps,po,clerk,sbi,up,pcs,psc,mp,andhra,telangana,2017,2018,2019,2020,clat,bba,exam,exams,top,read,for,to,on,at,from,hindi,in hindi,english,current affairs 2017,issue,debate,discussion,uppsc,uppcs,mppsc,cgpsc,tpsc,tspsc,appsc,mpsc,ras,rpsc,reet,jssc,ssc cgl,ssc ldc,steno,the"
"tamil news,tamilnadu politics comedy,tamil political speech,tamil political fight,latest tamil news,tamil news today,tamil news online,newsglitz,nakkeeran gopal interview,nakkeeran gopal latest interview,nakkeeran gopal speech,nakkeeran gopal speech about jayalalitha,nakkeeran on raid,nakkheeran about sasikala,sasikala raid,sasikala latest"
"à¤°à¤¾à¤¶à¤¿à¤«à¤² 2017,rashifal 2017 - YouTube,Saturn transit in Saggitarius,Saturn transit,Shani ka Dhanu rashi me,Shani karenge malamal,Shani gochar 2017,khulega kismat ka taala,bigboss2017,13 novembe"
"rich,millionaire,habits,hindi,urdu,7 habits,of,self made,millionaires,billionaires,behaviour,secrets,7 habits of highly effective people,brian,tracy,book,summary,21 secrets,of self made,effective people,responsibility,big dream,work hard,relations,speed"
"my tv,my bollywood,latest tv news,indian tv shows,reality shows,exclusive interview,eviction interview,bigg boss 11 contestants,bigg boss controversy,bigg boss fight,bigg boss shilpa shinde,vikas gupta,bigg boss 11,bigg boss 11 full episode,bigg boss 11 today episode,bigg boss season 11,full episode,shilpa shinde,hina khan,salman khan,mehjabi elimination,mehjabi eviction interview,mehjabi eviction,mehjabi hina fight"
"Vaani rani,rani,Radhika in funny character,venu aravind,SunTV,VaniRani,vani,vaani,Radhikas dual role serial,Ranimma veetu kuripu,Radhika as lawyer in serial,radikaa,rathika,Radhikas new"
"sumantv,à°ªà±à°°à°¤à°¿ à°¸à±‹à°®à°µà°¾à°°à°‚ à°ˆ 19 à°°à±‚à°ªà°¾à°²à°²à±‹ à°¶à°¿à°µà±à°¡à± à°®à±€ à°šà±à°Ÿà±à°Ÿà±‚à°¨à±‡ à°¤à°¿à°°à±à°—à±à°¤à°¾à°¡à±..! Lord Shiva 19 Avatars,à°ªà±à°°à°¤à°¿ à°¸à±‹à°®à°µà°¾à°°à°‚ à°ˆ 19 à°°à±‚à°ªà°¾à°²à°²à±‹ à°¶à°¿à°µà±à°¡à± à°®à±€ à°šà±à°Ÿà±à°Ÿà±‚à°¨à±‡ à°¤à°¿à°°à±à°—à±à°¤à°¾à°¡à±..!,à°¸à±‹à°®à°µà°¾à°°à°‚,19 à°°à±‚à°ªà°¾à°²à°²à±‹ à°¶à°¿à°µà±à°¡à±,à°¶à°¿à°µà±à°¡à± à°®à±€ à°šà±à°Ÿà±à°Ÿà±‚à°¨à±‡ à°¤à°¿à°°à±à°—à±à°¤à°¾à°¡à±,à°¶à°¿à°µà±à°¡à±,Lord Shiva 19 Avatars,Lord Shiva,shiva avatars,shiva pooja,shiva puja,lord shiva pooja,lord siva pooja,benifits in karthika masam,à°ˆ à°°à±‹à°œà± à°•à°¾à°°à±à°¤à±€à°•à°®à°¾à°¸ à°šà°¿à°µà°°à°¿ à°¸à±‹à°®à°µà°¾à°°à°‚ à°‡à°¦à°¿ à°µà°¿à°‚à°Ÿà±‡ 1000 à°¸à°¾à°°à±à°²à± à°•à°¾à°¶à±€ à°µà±†à°³à±à°²à°¿à°¨à°‚à°¤ à°ªà±à°£à±à°¯à°‚ à°¦à°•à±à°•à±à°¤à±à°‚à°¦à°¿.! Lord Shiva,shiva stuthi,shiva songs"
"Abish,Mathew,Abish Mathew,stand up,comedy,Abish Mathew stand up comedy,abish mathew comedy,son of abish,vir das,Irrfan khan"
"Venkatesh Wife,Venkatesh,venkatesh daggubati,daggubati,venkatesh wife,venkatesh wife photos,venkatesh wife videos,video,Venkatesh Neeraja,neeraja,venkatesh wife name neeraja,samantha,samantha naga chaitanya,naga chaitanya,wedding reception,reception,samantha naga chaitanya wedding reception,wedding,samantha naga chaitanya marriage,tollywood,celebs,allu arjun,allu arjun wife,sneha reddy,rana,rana daggubati,suresh babu,nagarjuna,wife"
"superhero,kid with superpowers,indian superhero,mahaghajini,shweta kawatra,bhayankar pari,sudeepa singh,rani pari,montu,purvesh pimple,baalpari,superpowers,sony,sony pal,hindi tv show,hindi serials,serials for kids,fantasy serials,pari lok,bhaynak lok,baalveer,watch baalveer online,watch balveer for free,à¤¬à¤¾à¤² à¤µà¥€à¤°,daityani,ghost,scared children,haunted house,bhootlok"
"Pradeep Machiraju,Anchor Pradeep,pradeep machiraju,konchem touch lo unte chepta,konchem touch lo unta season 3,konchem touch lo unte cheputha latest episode,KTUC 3,KTUC Season 3,konchem touch lo unte cheputha varun tej,Konchem Touch Lo Unte Chepta Season 3 - Akkineni Nagarjuna,Zee telugu,KTUC New Promo,Navdeep,konchemm touch lo unte cheputha latest episode,KTUC latest episode,Rajasekhar and his Family,KTUC Rajasekhar and his family promo,KTUC Rajasekhar promo"
"Sony Music India,Sony Music,Latest Hits,kollywood,mersal songs,mersal songs vijay,mersal songs tamil,mersal songs 2017,mersal ar rahman,mersal single track,mersal movie,mersal audio launch,vijay songs,A R Rahman,vijay videos,vijay mersal"
"Manorama News,News,Politics,Kerala News,Breaking News,Latest News,Kerala,youtube,idukki,elephant,elephant hit"
"Aruvi,Aruvi Tamil Movie,Aruvi Movie,Aruvi Teaser,Aruvi Tamil Movie Teaser,Aruvi Award Winning Movie,Aruvi Movie Teaser,Aruvi Official Teaser,Aditi Balan,Anjali Varathan,Muhammad Ali Baig,Kavitha Bharathi,Lakshmi Gopalswamy,Pradeep Antony,Arun Prabu Purushothaman,Dream Warrior Pictures,S.R. Prakash Babu,S.R. Prabhu,Aruvi Tamil Teaser"
"à¤¸à¤¿à¤•à¥à¤•à¤¾ à¤‡à¤¤à¤¨à¤¾ à¤†à¤¯à¥‡à¤—à¤¾ à¤ªà¥ˆà¤¸à¤¾ à¤•à¥€ à¤¸à¤‚à¤­à¤¾à¤² à¤¨à¤¹à¥€ à¤ªà¤¾à¤“à¤—à¥‡,à¤•à¥ˆà¤®à¥‡à¤°à¥‡ à¤®à¥‡à¤‚ à¤¹à¥à¤† à¤•à¥ˆà¤¦ à¤¨à¤¹à¥€à¤‚ à¤¤à¥‹ à¤†à¤ª à¤¯à¤•à¥€à¤¨ à¤¨à¤¹à¥€à¤‚ à¤•à¤°à¤¤à¥‡,à¤§à¤¨à¤¤à¥‡à¤°à¤¸,à¤²à¤•à¥à¤·à¥à¤®à¥€ à¤ªà¥‚à¤œà¤¾,à¤¦à¥à¤°à¥à¤—à¤¾ à¤†à¤°à¤¤à¥€,à¤µà¤¿à¤§à¥€,à¤¶à¤¾à¤¸à¥à¤¤à¥à¤°,à¤²à¤•à¥à¤·à¥à¤®à¥€ à¤”à¤° à¤•à¥à¤¬à¥‡à¤° à¤¸à¤¾à¤¥ à¤†à¤¯à¥‡à¤‚à¤—à¥‡ à¤˜à¤°,à¤‰à¤ªà¤¾à¤¯,à¤–à¥à¤¬ à¤ªà¥ˆà¤¸à¤¾ à¤•à¤®à¤¾à¤¨à¤¾ à¤¹à¥ˆ à¤¤à¥‹,à¤²à¤•à¥à¤·à¥à¤®à¥€ à¤¦à¥Œà¤¡à¤¼à¥€ à¤šà¤²à¥€ à¤†à¤à¤—à¥€ à¤†à¤ªà¤•à¥‡ à¤˜à¤°,18 à¤¨à¤µà¤®à¥à¤¬à¤° à¤¶à¤¨à¤¿ à¤…à¤®à¤¾à¤µà¤¸à¥à¤¯à¤¾ à¤œà¤¼à¤°à¤¾ à¤¸à¤¾ à¤¸à¤°à¤¸à¥‹à¤‚ à¤•à¤¾ à¤¤à¥‡à¤² à¤šà¤®à¤•à¤¾ à¤¦à¥‡à¤—à¤¾ à¤•à¤¿à¤¸à¥à¤®à¤¤ à¤‡à¤¤à¤¨à¤¾ à¤†à¤¯à¥‡à¤—à¤¾ à¤ªà¥ˆà¤¸à¤¾ à¤•à¥€ à¤¸à¤‚à¤­à¤¾à¤² à¤¨à¤¹à¥€ à¤ªà¤¾à¤“à¤—à¥‡,18 à¤¨à¤µà¤®à¥à¤¬à¤° à¤¶à¤¨à¤¿ à¤…à¤®à¤¾à¤µà¤¸à¥à¤¯à¤¾,à¤œà¤¼à¤°à¤¾ à¤¸à¤¾ à¤¸à¤°à¤¸à¥‹à¤‚ à¤•à¤¾ à¤¤à¥‡à¤² à¤šà¤®à¤•à¤¾ à¤¦à¥‡à¤—à¤¾ à¤•à¤¿à¤¸à¥à¤®à¤¤,à¤¶à¤¨à¤¿ à¤…à¤®à¤¾à¤µà¤¸à¥à¤¯à¤¾ à¤ªà¤° à¤¸à¥à¤¬à¤¹ à¤•à¤°à¥‡à¤‚ à¤²à¥‹à¤¹à¥‡ à¤•à¥€ à¤•à¤Ÿà¥‹à¤°à¥€ à¤”à¤° à¤¸à¤°à¤¸à¥‹à¤‚ à¤•à¥‡ à¤¤à¥‡à¤² à¤•à¤¾ à¤šà¤®à¤¤à¥à¤•à¤¾à¤°à¥€ à¤‰à¤ªà¤¾à¤¯,18 à¤¨à¤µà¤®à¥à¤¬à¤°,18 à¤¨à¤µà¤®à¥à¤¬à¤° 2017"
"sneak food,how to sneak food into class,class hacks,school food,food in class,sneak food into class,how to sneak food into school,take food to school,weird school supplies,school pranks,back to school,hide food,eating in class,ways to sneak food into class,how to sneak food in class,how to sneak food in school,best school pranks,back to school pranks,prank,school"
